{
  "schemaVersion": 1,
  "generatedAtUtc": "2026-10-20T10:01:17Z",
  "provider": {
    "id": "gdelt-doc-2",
    "name": "GDELT DOC 2.0 API",
    "readOnly": true,
    "documentationUrl": "https://blog.gdeltproject.org/gdelt-doc-2-0-api-debuts/"
  },
  "collection": {
    "status": "partial",
    "expectedCadence": "Hourly",
    "queryCount": 6,
    "successfulQueryCount": 1,
    "rawArticleCount": 50,
    "selectedArticleCount": 48,
    "lastSuccessfulAt": "2026-10-20T10:01:17Z",
    "error": "strategic-materials: HTTPError: HTTP Error 429: Too Many Requests; ags-softs: HTTPError: HTTP Error 429: Too Many Requests; gas-markets: HTTPError: HTTP Error 429: Too Many Requests; semiconductors-ai: HTTPError: HTTP Error 429: Too Many Requests; macro-policy: HTTPError: HTTP Error 429: Too Many Requests"
  },
  "disclaimer": "Unverified discovery radar. A GDELT match is evidence that media coverage exists, not proof that the underlying claim is true or financially material.",
  "topics": [
    {
      "id": "strategic-materials",
      "name": "Strategic materials",
      "query": "(\"rare earth\" OR \"critical mineral\" OR uranium OR copper OR gold OR silver OR lithium)"
    },
    {
      "id": "ags-softs",
      "name": "Agriculture & softs",
      "query": "(wheat OR grain OR cocoa OR coffee OR harvest OR drought OR \"crop failure\" OR \"export ban\")"
    },
    {
      "id": "gas-markets",
      "name": "Gas markets",
      "query": "(TTF OR NBP OR \"gas storage\" OR LNG OR pipeline OR \"natural gas\")"
    },
    {
      "id": "semiconductors-ai",
      "name": "Semiconductors & AI infrastructure",
      "query": "(semiconductor OR \"artificial intelligence\" OR \"data center\" OR HBM OR \"advanced packaging\")"
    },
    {
      "id": "macro-policy",
      "name": "Macro, trade & policy",
      "query": "(tariff OR \"export control\" OR sanction OR inflation OR \"central bank\" OR recession)"
    },
    {
      "id": "energy-security",
      "name": "Energy & security",
      "query": "(oil OR LNG OR \"natural gas\" OR OPEC OR nuclear OR defence OR defense)"
    }
  ],
  "articles": [
    {
      "id": "1d0cca59c9ac59094e23",
      "title": "Подсанкционные танкеры США разрешили продажу судов теневого флота",
      "url": "https://focus.ua/world/771781-podsankcionnye-tankery-ssha-razreshili-prodazhu-sudov-tenevogo-flota",
      "domain": "focus.ua",
      "language": "Russian",
      "sourceCountry": "Ukraine",
      "seenAt": "2026-10-20T08:00:00Z",
      "firstSeenAt": "2026-10-20T08:00:00Z",
      "topicIds": [
        "energy-security"
      ],
      "topics": [
        "Energy & security"
      ],
      "assets": [
        "brent",
        "defence",
        "gas-uk",
        "gas-us",
        "uranium",
        "wti"
      ],
      "materialityScore": 20,
      "sourceTier": "discovery",
      "verificationStatus": "unverified",
      "verificationNote": "Discovery lead only. Confirm against an official filing, company release, government source or trusted financial wire.",
      "duplicateCount": 1
    },
    {
      "id": "f7618c1e6d4a7c13828a",
      "title": "Износът на руски петрол през Арктика вече надхвърля с близо 50 % миналогодишния",
      "url": "https://www.investor.bg/a/518-energetika/438232-iznosat-na-ruski-petrol-prez-arktika-veche-nadhvarlya-s-blizo-50-minalogodishniya",
      "domain": "investor.bg",
      "language": "Bulgarian",
      "sourceCountry": "Bulgaria",
      "seenAt": "2026-10-20T08:00:00Z",
      "firstSeenAt": "2026-10-20T08:00:00Z",
      "topicIds": [
        "energy-security"
      ],
      "topics": [
        "Energy & security"
      ],
      "assets": [
        "brent",
        "defence",
        "gas-uk",
        "gas-us",
        "uranium",
        "wti"
      ],
      "materialityScore": 20,
      "sourceTier": "discovery",
      "verificationStatus": "unverified",
      "verificationNote": "Discovery lead only. Confirm against an official filing, company release, government source or trusted financial wire.",
      "duplicateCount": 1
    },
    {
      "id": "6da4b79d87612a1f8b50",
      "title": "Major oil companies considering a move back into Iraq to tap oil reserves",
      "url": "https://www.smh.com.au/business/markets/we-re-not-afraid-of-risk-big-oil-goes-back-to-iraq-20261020-p6151k.html",
      "domain": "smh.com.au",
      "language": "English",
      "sourceCountry": "Australia",
      "seenAt": "2026-10-20T08:00:00Z",
      "firstSeenAt": "2026-10-20T08:00:00Z",
      "topicIds": [
        "energy-security"
      ],
      "topics": [
        "Energy & security"
      ],
      "assets": [
        "brent",
        "defence",
        "gas-uk",
        "gas-us",
        "uranium",
        "wti"
      ],
      "materialityScore": 20,
      "sourceTier": "discovery",
      "verificationStatus": "unverified",
      "verificationNote": "Discovery lead only. Confirm against an official filing, company release, government source or trusted financial wire.",
      "duplicateCount": 1
    },
    {
      "id": "0e7b553010c6d456deb8",
      "title": "Русия с голям пробив в Арктика . Три световни кризи й отвориха нов път",
      "url": "https://www.standartnews.com/svyat/rusiya-s-golyam-probiv-v-arktika-tri-svetovni-krizi-y-otvoriha-nov-pat-650554.html",
      "domain": "standartnews.com",
      "language": "Bulgarian",
      "sourceCountry": "Bulgaria",
      "seenAt": "2026-10-20T07:45:00Z",
      "firstSeenAt": "2026-10-20T07:45:00Z",
      "topicIds": [
        "energy-security"
      ],
      "topics": [
        "Energy & security"
      ],
      "assets": [
        "brent",
        "defence",
        "gas-uk",
        "gas-us",
        "uranium",
        "wti"
      ],
      "materialityScore": 20,
      "sourceTier": "discovery",
      "verificationStatus": "unverified",
      "verificationNote": "Discovery lead only. Confirm against an official filing, company release, government source or trusted financial wire.",
      "duplicateCount": 1
    },
    {
      "id": "e7ecb4d4d97f6201954b",
      "title": "Підсанкційні танкери США дозволили продаж суден тіньового флоту",
      "url": "https://focus.ua/uk/world/771781-pidsankciyni-tankeri-ssha-dozvolili-prodazh-suden-tinovogo-flotu",
      "domain": "focus.ua",
      "language": "Ukrainian",
      "sourceCountry": "Ukraine",
      "seenAt": "2026-10-20T07:45:00Z",
      "firstSeenAt": "2026-10-20T07:45:00Z",
      "topicIds": [
        "energy-security"
      ],
      "topics": [
        "Energy & security"
      ],
      "assets": [
        "brent",
        "defence",
        "gas-uk",
        "gas-us",
        "uranium",
        "wti"
      ],
      "materialityScore": 20,
      "sourceTier": "discovery",
      "verificationStatus": "unverified",
      "verificationNote": "Discovery lead only. Confirm against an official filing, company release, government source or trusted financial wire.",
      "duplicateCount": 1
    },
    {
      "id": "849c776c14a2bf2549ce",
      "title": "LNGPH considers third tank to strengthen gas platform",
      "url": "https://www.philstar.com/business/stock-commentary/2026/10/20/2564547/lngph-considers-third-tank-strengthen-gas-platform",
      "domain": "philstar.com",
      "language": "English",
      "sourceCountry": "Philippines",
      "seenAt": "2026-10-20T07:15:00Z",
      "firstSeenAt": "2026-10-20T07:15:00Z",
      "topicIds": [
        "energy-security"
      ],
      "topics": [
        "Energy & security"
      ],
      "assets": [
        "brent",
        "defence",
        "gas-uk",
        "gas-us",
        "uranium",
        "wti"
      ],
      "materialityScore": 20,
      "sourceTier": "discovery",
      "verificationStatus": "unverified",
      "verificationNote": "Discovery lead only. Confirm against an official filing, company release, government source or trusted financial wire.",
      "duplicateCount": 1
    },
    {
      "id": "d19939a04f06aff7db04",
      "title": "Το πετρέλαιο Brent « φλερτάρει » με τα 110 δολάρια - Ξεπερνούν τα 88 ευρώ οι τιμές του φυσικού αερίου",
      "url": "https://www.epikaira.gr/to-petrelaio-brent-flertarei-me-ta-110-dolaria-xepernoun-ta-88-evro-oi-times-tou-fysikou-aeriou/",
      "domain": "epikaira.gr",
      "language": "Greek",
      "sourceCountry": "Greece",
      "seenAt": "2026-10-20T06:30:00Z",
      "firstSeenAt": "2026-10-20T06:30:00Z",
      "topicIds": [
        "energy-security"
      ],
      "topics": [
        "Energy & security"
      ],
      "assets": [
        "brent",
        "defence",
        "gas-uk",
        "gas-us",
        "uranium",
        "wti"
      ],
      "materialityScore": 20,
      "sourceTier": "discovery",
      "verificationStatus": "unverified",
      "verificationNote": "Discovery lead only. Confirm against an official filing, company release, government source or trusted financial wire.",
      "duplicateCount": 1
    },
    {
      "id": "b9cf2411af5c4dce38b2",
      "title": "Consumers hit hard as LPG prices surge to Rs500 / Kg in Punjab , KP",
      "url": "https://en.dailypakistan.com.pk/20-Oct-2026/consumers-hit-hard-as-lpg-prices-surge-to-rs500-kg-in-punjab-kp",
      "domain": "en.dailypakistan.com.pk",
      "language": "English",
      "sourceCountry": "Pakistan",
      "seenAt": "2026-10-20T06:15:00Z",
      "firstSeenAt": "2026-10-20T06:15:00Z",
      "topicIds": [
        "energy-security"
      ],
      "topics": [
        "Energy & security"
      ],
      "assets": [
        "brent",
        "defence",
        "gas-uk",
        "gas-us",
        "uranium",
        "wti"
      ],
      "materialityScore": 20,
      "sourceTier": "discovery",
      "verificationStatus": "unverified",
      "verificationNote": "Discovery lead only. Confirm against an official filing, company release, government source or trusted financial wire.",
      "duplicateCount": 1
    },
    {
      "id": "005e654aac218ab8ae7f",